03-Dec-21 02:50:43 - IP 192.168.1.88:7005 > 192.168.1.200:7005: Flags [S], seq 0, ack 0, win 1, length 1 
03-Dec-21 02:50:45 - IP 192.168.1.200:7005 > 192.168.1.88:7005: Flags [.], seq 0, ack 1, win 1, length 1 
03-Dec-21 02:50:53 - IP 192.168.1.88:7005 > 192.168.1.200:7005: Flags [P.], seq 1, ack 1, win 1, length 4 
03-Dec-21 02:50:55 - IP 192.168.1.200:7005 > 192.168.1.88:7005: Flags [.], seq 1, ack 5, win 1, length 1 
03-Dec-21 02:50:55 - IP 192.168.1.88:7005 > 192.168.1.200:7005: Flags [P.], seq 5, ack 2, win 2, length 4 
03-Dec-21 02:50:55 - IP 192.168.1.88:7005 > 192.168.1.200:7005: Flags [P.], seq 9, ack 2, win 2, length 2 
03-Dec-21 02:50:58 - IP 192.168.1.200:7005 > 192.168.1.88:7005: Flags [.], seq 2, ack 9, win 2, length 1 
03-Dec-21 02:50:59 - IP 192.168.1.200:7005 > 192.168.1.88:7005: Flags [.], seq 2, ack 11, win 2, length 1 
03-Dec-21 02:51:11 - IP 192.168.1.88:7005 > 192.168.1.200:7005: Flags [E], seq 11, ack 3, win 1, length 1 
03-Dec-21 02:51:13 - IP 192.168.1.200:7005 > 192.168.1.88:7005: Flags [.], seq 3, ack 12, win 1, length 1 
03-Dec-21 02:51:13 - Transmitter Shutting Down...
03-Dec-21 02:51:13 - Total Packets Sent: 5
03-Dec-21 02:51:13 - Total Packets Re-Sent: 0
