03-Dec-21 01:15:25 - IP 192.168.1.88:7005 > 192.168.1.200:7005: Flags [S], seq 0, ack 0, win 1, length 1 
03-Dec-21 01:15:25 - IP 192.168.1.200:7005 > 192.168.1.88:7005: Flags [.], seq 0, ack 1, win 1, length 1 
03-Dec-21 01:17:25 - Duplicate ACK: 
03-Dec-21 01:17:25 - IP 192.168.1.88:7005 > 192.168.1.200:7005: Flags [S], seq 0, ack 0, win 1, length 1 
03-Dec-21 01:17:25 - IP 192.168.1.200:7005 > 192.168.1.88:7005: Flags [.], seq 0, ack 1, win 1, length 1 
03-Dec-21 01:19:29 - IP 192.168.1.88:7005 > 192.168.1.200:7005: Flags [P.], seq 1, ack 1, win 1, length 4 
03-Dec-21 01:19:29 - IP 192.168.1.200:7005 > 192.168.1.88:7005: Flags [.], seq 1, ack 5, win 1, length 1 
03-Dec-21 01:19:49 - Duplicate ACK: 
03-Dec-21 01:19:49 - IP 192.168.1.88:7005 > 192.168.1.200:7005: Flags [P.], seq 1, ack 1, win 1, length 4 
03-Dec-21 01:19:49 - IP 192.168.1.200:7005 > 192.168.1.88:7005: Flags [.], seq 1, ack 5, win 1, length 1 
03-Dec-21 01:20:09 - Duplicate ACK: 
03-Dec-21 01:20:09 - IP 192.168.1.88:7005 > 192.168.1.200:7005: Flags [P.], seq 1, ack 1, win 1, length 4 
03-Dec-21 01:20:09 - IP 192.168.1.200:7005 > 192.168.1.88:7005: Flags [.], seq 1, ack 5, win 1, length 1 
03-Dec-21 01:20:39 - Duplicate ACK: 
03-Dec-21 01:20:39 - IP 192.168.1.88:7005 > 192.168.1.200:7005: Flags [P.], seq 1, ack 1, win 1, length 4 
03-Dec-21 01:20:39 - IP 192.168.1.200:7005 > 192.168.1.88:7005: Flags [.], seq 1, ack 5, win 1, length 1 
03-Dec-21 01:20:41 - IP 192.168.1.88:7005 > 192.168.1.200:7005: Flags [P.], seq 5, ack 2, win 2, length 4 
03-Dec-21 01:20:41 - IP 192.168.1.200:7005 > 192.168.1.88:7005: Flags [.], seq 2, ack 9, win 2, length 1 
03-Dec-21 01:20:42 - IP 192.168.1.88:7005 > 192.168.1.200:7005: Flags [P.], seq 9, ack 2, win 2, length 2 
03-Dec-21 01:20:42 - IP 192.168.1.200:7005 > 192.168.1.88:7005: Flags [.], seq 2, ack 11, win 2, length 1 
03-Dec-21 01:21:12 - Duplicate ACK: 
03-Dec-21 01:21:12 - IP 192.168.1.88:7005 > 192.168.1.200:7005: Flags [P.], seq 5, ack 2, win 2, length 4 
03-Dec-21 01:21:12 - IP 192.168.1.200:7005 > 192.168.1.88:7005: Flags [.], seq 2, ack 9, win 2, length 1 
03-Dec-21 01:21:21 - IP 192.168.1.88:7005 > 192.168.1.200:7005: Flags [P.], seq 9, ack 2, win 2, length 2 
03-Dec-21 01:21:21 - IP 192.168.1.200:7005 > 192.168.1.88:7005: Flags [.], seq 2, ack 11, win 2, length 1 
03-Dec-21 01:21:41 - Duplicate ACK: 
03-Dec-21 01:21:41 - IP 192.168.1.88:7005 > 192.168.1.200:7005: Flags [P.], seq 9, ack 2, win 2, length 2 
03-Dec-21 01:21:41 - IP 192.168.1.200:7005 > 192.168.1.88:7005: Flags [.], seq 2, ack 11, win 2, length 1 
03-Dec-21 01:22:51 - Duplicate ACK: 
03-Dec-21 01:22:51 - IP 192.168.1.88:7005 > 192.168.1.200:7005: Flags [P.], seq 5, ack 2, win 2, length 4 
03-Dec-21 01:22:51 - IP 192.168.1.200:7005 > 192.168.1.88:7005: Flags [.], seq 2, ack 9, win 2, length 1 
03-Dec-21 01:23:21 - Duplicate ACK: 
03-Dec-21 01:23:21 - IP 192.168.1.88:7005 > 192.168.1.200:7005: Flags [P.], seq 5, ack 2, win 2, length 4 
03-Dec-21 01:23:21 - IP 192.168.1.200:7005 > 192.168.1.88:7005: Flags [.], seq 2, ack 9, win 2, length 1 
03-Dec-21 01:23:51 - Duplicate ACK: 
03-Dec-21 01:23:51 - IP 192.168.1.88:7005 > 192.168.1.200:7005: Flags [P.], seq 5, ack 2, win 2, length 4 
03-Dec-21 01:23:51 - IP 192.168.1.200:7005 > 192.168.1.88:7005: Flags [.], seq 2, ack 9, win 2, length 1 
03-Dec-21 01:24:11 - Duplicate ACK: 
03-Dec-21 01:24:11 - IP 192.168.1.88:7005 > 192.168.1.200:7005: Flags [P.], seq 5, ack 2, win 2, length 4 
03-Dec-21 01:24:11 - IP 192.168.1.200:7005 > 192.168.1.88:7005: Flags [.], seq 2, ack 9, win 2, length 1 
03-Dec-21 01:25:21 - Duplicate ACK: 
03-Dec-21 01:25:21 - IP 192.168.1.88:7005 > 192.168.1.200:7005: Flags [P.], seq 5, ack 2, win 2, length 4 
03-Dec-21 01:25:21 - IP 192.168.1.200:7005 > 192.168.1.88:7005: Flags [.], seq 2, ack 9, win 2, length 1 
03-Dec-21 01:25:22 - IP 192.168.1.88:7005 > 192.168.1.200:7005: Flags [P.], seq 9, ack 2, win 2, length 2 
03-Dec-21 01:25:22 - IP 192.168.1.200:7005 > 192.168.1.88:7005: Flags [.], seq 2, ack 11, win 2, length 1 
03-Dec-21 01:26:05 - Duplicate ACK: 
03-Dec-21 01:26:05 - IP 192.168.1.88:7005 > 192.168.1.200:7005: Flags [P.], seq 9, ack 2, win 2, length 2 
03-Dec-21 01:26:05 - IP 192.168.1.200:7005 > 192.168.1.88:7005: Flags [.], seq 2, ack 11, win 2, length 1 
03-Dec-21 01:26:45 - Duplicate ACK: 
03-Dec-21 01:26:45 - IP 192.168.1.88:7005 > 192.168.1.200:7005: Flags [P.], seq 5, ack 2, win 2, length 4 
03-Dec-21 01:26:45 - IP 192.168.1.200:7005 > 192.168.1.88:7005: Flags [.], seq 2, ack 9, win 2, length 1 
03-Dec-21 01:27:05 - IP 192.168.1.88:7005 > 192.168.1.200:7005: Flags [P.], seq 9, ack 2, win 2, length 2 
03-Dec-21 01:27:05 - IP 192.168.1.200:7005 > 192.168.1.88:7005: Flags [.], seq 2, ack 11, win 2, length 1 
03-Dec-21 01:28:45 - Duplicate ACK: 
03-Dec-21 01:28:45 - IP 192.168.1.88:7005 > 192.168.1.200:7005: Flags [P.], seq 5, ack 2, win 2, length 4 
03-Dec-21 01:28:45 - IP 192.168.1.200:7005 > 192.168.1.88:7005: Flags [.], seq 2, ack 9, win 2, length 1 
03-Dec-21 01:28:57 - Duplicate ACK: 
03-Dec-21 01:28:57 - IP 192.168.1.88:7005 > 192.168.1.200:7005: Flags [P.], seq 5, ack 2, win 2, length 4 
03-Dec-21 01:28:57 - IP 192.168.1.200:7005 > 192.168.1.88:7005: Flags [.], seq 2, ack 9, win 2, length 1 
03-Dec-21 01:28:58 - IP 192.168.1.88:7005 > 192.168.1.200:7005: Flags [P.], seq 9, ack 2, win 2, length 2 
03-Dec-21 01:28:58 - IP 192.168.1.200:7005 > 192.168.1.88:7005: Flags [.], seq 2, ack 11, win 2, length 1 
03-Dec-21 01:29:48 - Duplicate ACK: 
03-Dec-21 01:29:48 - IP 192.168.1.88:7005 > 192.168.1.200:7005: Flags [P.], seq 5, ack 2, win 2, length 4 
03-Dec-21 01:29:48 - IP 192.168.1.200:7005 > 192.168.1.88:7005: Flags [.], seq 2, ack 9, win 2, length 1 
03-Dec-21 01:30:17 - Duplicate ACK: 
03-Dec-21 01:30:17 - IP 192.168.1.88:7005 > 192.168.1.200:7005: Flags [P.], seq 5, ack 2, win 2, length 4 
03-Dec-21 01:30:17 - IP 192.168.1.200:7005 > 192.168.1.88:7005: Flags [.], seq 2, ack 9, win 2, length 1 
03-Dec-21 01:30:27 - Duplicate ACK: 
03-Dec-21 01:30:27 - IP 192.168.1.88:7005 > 192.168.1.200:7005: Flags [P.], seq 5, ack 2, win 2, length 4 
03-Dec-21 01:30:27 - IP 192.168.1.200:7005 > 192.168.1.88:7005: Flags [.], seq 2, ack 9, win 2, length 1 
03-Dec-21 01:30:28 - IP 192.168.1.88:7005 > 192.168.1.200:7005: Flags [P.], seq 9, ack 2, win 2, length 2 
03-Dec-21 01:30:28 - IP 192.168.1.200:7005 > 192.168.1.88:7005: Flags [.], seq 2, ack 11, win 2, length 1 
03-Dec-21 01:30:51 - Duplicate ACK: 
03-Dec-21 01:30:51 - IP 192.168.1.88:7005 > 192.168.1.200:7005: Flags [P.], seq 9, ack 2, win 2, length 2 
03-Dec-21 01:30:51 - IP 192.168.1.200:7005 > 192.168.1.88:7005: Flags [.], seq 2, ack 11, win 2, length 1 
03-Dec-21 01:31:03 - Duplicate ACK: 
03-Dec-21 01:31:03 - IP 192.168.1.88:7005 > 192.168.1.200:7005: Flags [P.], seq 9, ack 2, win 2, length 2 
03-Dec-21 01:31:03 - IP 192.168.1.200:7005 > 192.168.1.88:7005: Flags [.], seq 2, ack 11, win 2, length 1 
03-Dec-21 01:31:43 - Duplicate ACK: 
03-Dec-21 01:31:43 - IP 192.168.1.88:7005 > 192.168.1.200:7005: Flags [P.], seq 5, ack 2, win 2, length 4 
03-Dec-21 01:31:43 - IP 192.168.1.200:7005 > 192.168.1.88:7005: Flags [.], seq 2, ack 9, win 2, length 1 
03-Dec-21 01:31:44 - IP 192.168.1.88:7005 > 192.168.1.200:7005: Flags [P.], seq 9, ack 2, win 2, length 2 
03-Dec-21 01:31:44 - IP 192.168.1.200:7005 > 192.168.1.88:7005: Flags [.], seq 2, ack 11, win 2, length 1 
03-Dec-21 01:31:53 - Duplicate ACK: 
03-Dec-21 01:31:53 - IP 192.168.1.88:7005 > 192.168.1.200:7005: Flags [P.], seq 9, ack 2, win 2, length 2 
03-Dec-21 01:31:53 - IP 192.168.1.200:7005 > 192.168.1.88:7005: Flags [.], seq 2, ack 11, win 2, length 1 
03-Dec-21 01:32:03 - Duplicate ACK: 
03-Dec-21 01:32:03 - IP 192.168.1.88:7005 > 192.168.1.200:7005: Flags [P.], seq 9, ack 2, win 2, length 2 
03-Dec-21 01:32:03 - IP 192.168.1.200:7005 > 192.168.1.88:7005: Flags [.], seq 2, ack 11, win 2, length 1 
03-Dec-21 01:32:15 - Duplicate ACK: 
03-Dec-21 01:32:15 - IP 192.168.1.88:7005 > 192.168.1.200:7005: Flags [P.], seq 5, ack 2, win 2, length 4 
03-Dec-21 01:32:15 - IP 192.168.1.200:7005 > 192.168.1.88:7005: Flags [.], seq 2, ack 9, win 2, length 1 
03-Dec-21 01:32:25 - Duplicate ACK: 
03-Dec-21 01:32:25 - IP 192.168.1.88:7005 > 192.168.1.200:7005: Flags [P.], seq 5, ack 2, win 2, length 4 
03-Dec-21 01:32:25 - IP 192.168.1.200:7005 > 192.168.1.88:7005: Flags [.], seq 2, ack 9, win 2, length 1 
03-Dec-21 01:32:35 - Duplicate ACK: 
03-Dec-21 01:32:35 - IP 192.168.1.88:7005 > 192.168.1.200:7005: Flags [P.], seq 5, ack 2, win 2, length 4 
03-Dec-21 01:32:35 - IP 192.168.1.200:7005 > 192.168.1.88:7005: Flags [.], seq 2, ack 9, win 2, length 1 
03-Dec-21 01:32:45 - IP 192.168.1.88:7005 > 192.168.1.200:7005: Flags [P.], seq 9, ack 2, win 2, length 2 
03-Dec-21 01:32:45 - IP 192.168.1.200:7005 > 192.168.1.88:7005: Flags [.], seq 2, ack 11, win 2, length 1 
03-Dec-21 01:32:57 - Duplicate ACK: 
03-Dec-21 01:32:57 - IP 192.168.1.88:7005 > 192.168.1.200:7005: Flags [P.], seq 5, ack 2, win 2, length 4 
03-Dec-21 01:32:57 - IP 192.168.1.200:7005 > 192.168.1.88:7005: Flags [.], seq 2, ack 9, win 2, length 1 
03-Dec-21 01:33:07 - Duplicate ACK: 
03-Dec-21 01:33:07 - IP 192.168.1.88:7005 > 192.168.1.200:7005: Flags [P.], seq 5, ack 2, win 2, length 4 
03-Dec-21 01:33:07 - IP 192.168.1.200:7005 > 192.168.1.88:7005: Flags [.], seq 2, ack 9, win 2, length 1 
03-Dec-21 01:33:19 - Duplicate ACK: 
03-Dec-21 01:33:19 - IP 192.168.1.88:7005 > 192.168.1.200:7005: Flags [P.], seq 5, ack 2, win 2, length 4 
03-Dec-21 01:33:19 - IP 192.168.1.200:7005 > 192.168.1.88:7005: Flags [.], seq 2, ack 9, win 2, length 1 
03-Dec-21 01:33:29 - Duplicate ACK: 
03-Dec-21 01:33:29 - IP 192.168.1.88:7005 > 192.168.1.200:7005: Flags [P.], seq 5, ack 2, win 2, length 4 
03-Dec-21 01:33:29 - IP 192.168.1.200:7005 > 192.168.1.88:7005: Flags [.], seq 2, ack 9, win 2, length 1 
03-Dec-21 01:33:30 - IP 192.168.1.88:7005 > 192.168.1.200:7005: Flags [P.], seq 9, ack 2, win 2, length 2 
03-Dec-21 01:33:30 - IP 192.168.1.200:7005 > 192.168.1.88:7005: Flags [.], seq 2, ack 11, win 2, length 1 
03-Dec-21 01:33:52 - Duplicate ACK: 
03-Dec-21 01:33:52 - IP 192.168.1.88:7005 > 192.168.1.200:7005: Flags [P.], seq 9, ack 2, win 2, length 2 
03-Dec-21 01:33:52 - IP 192.168.1.200:7005 > 192.168.1.88:7005: Flags [.], seq 2, ack 11, win 2, length 1 
03-Dec-21 01:34:03 - Duplicate ACK: 
03-Dec-21 01:34:03 - IP 192.168.1.88:7005 > 192.168.1.200:7005: Flags [P.], seq 5, ack 2, win 2, length 4 
03-Dec-21 01:34:03 - IP 192.168.1.200:7005 > 192.168.1.88:7005: Flags [.], seq 2, ack 9, win 2, length 1 
03-Dec-21 01:34:13 - Duplicate ACK: 
03-Dec-21 01:34:13 - IP 192.168.1.88:7005 > 192.168.1.200:7005: Flags [P.], seq 5, ack 2, win 2, length 4 
03-Dec-21 01:34:13 - IP 192.168.1.200:7005 > 192.168.1.88:7005: Flags [.], seq 2, ack 9, win 2, length 1 
03-Dec-21 01:35:13 - IP 192.168.1.88:7005 > 192.168.1.200:7005: Flags [P.], seq 9, ack 2, win 2, length 2 
03-Dec-21 01:35:13 - IP 192.168.1.200:7005 > 192.168.1.88:7005: Flags [.], seq 2, ack 11, win 2, length 1 
03-Dec-21 01:35:23 - Duplicate ACK: 
03-Dec-21 01:35:23 - IP 192.168.1.88:7005 > 192.168.1.200:7005: Flags [P.], seq 9, ack 2, win 2, length 2 
03-Dec-21 01:35:23 - IP 192.168.1.200:7005 > 192.168.1.88:7005: Flags [.], seq 2, ack 11, win 2, length 1 
03-Dec-21 01:36:13 - Duplicate ACK: 
03-Dec-21 01:36:13 - IP 192.168.1.88:7005 > 192.168.1.200:7005: Flags [P.], seq 9, ack 2, win 2, length 2 
03-Dec-21 01:36:13 - IP 192.168.1.200:7005 > 192.168.1.88:7005: Flags [.], seq 2, ack 11, win 2, length 1 
03-Dec-21 01:36:23 - Duplicate ACK: 
03-Dec-21 01:36:23 - IP 192.168.1.88:7005 > 192.168.1.200:7005: Flags [P.], seq 5, ack 2, win 2, length 4 
03-Dec-21 01:36:23 - IP 192.168.1.200:7005 > 192.168.1.88:7005: Flags [.], seq 2, ack 9, win 2, length 1 
03-Dec-21 01:36:24 - IP 192.168.1.88:7005 > 192.168.1.200:7005: Flags [P.], seq 9, ack 2, win 2, length 2 
03-Dec-21 01:36:24 - IP 192.168.1.200:7005 > 192.168.1.88:7005: Flags [.], seq 2, ack 11, win 2, length 1 
03-Dec-21 01:36:33 - Duplicate ACK: 
03-Dec-21 01:36:33 - IP 192.168.1.88:7005 > 192.168.1.200:7005: Flags [P.], seq 9, ack 2, win 2, length 2 
03-Dec-21 01:36:33 - IP 192.168.1.200:7005 > 192.168.1.88:7005: Flags [.], seq 2, ack 11, win 2, length 1 
03-Dec-21 01:36:43 - Duplicate ACK: 
03-Dec-21 01:36:43 - IP 192.168.1.88:7005 > 192.168.1.200:7005: Flags [P.], seq 9, ack 2, win 2, length 2 
03-Dec-21 01:36:43 - IP 192.168.1.200:7005 > 192.168.1.88:7005: Flags [.], seq 2, ack 11, win 2, length 1 
03-Dec-21 01:36:55 - Duplicate ACK: 
03-Dec-21 01:36:55 - IP 192.168.1.88:7005 > 192.168.1.200:7005: Flags [P.], seq 5, ack 2, win 2, length 4 
03-Dec-21 01:36:55 - IP 192.168.1.200:7005 > 192.168.1.88:7005: Flags [.], seq 2, ack 9, win 2, length 1 
03-Dec-21 01:37:05 - Duplicate ACK: 
03-Dec-21 01:37:05 - IP 192.168.1.88:7005 > 192.168.1.200:7005: Flags [P.], seq 5, ack 2, win 2, length 4 
03-Dec-21 01:37:05 - IP 192.168.1.200:7005 > 192.168.1.88:7005: Flags [.], seq 2, ack 9, win 2, length 1 
03-Dec-21 01:37:55 - Duplicate ACK: 
03-Dec-21 01:37:55 - IP 192.168.1.88:7005 > 192.168.1.200:7005: Flags [P.], seq 5, ack 2, win 2, length 4 
03-Dec-21 01:37:55 - IP 192.168.1.200:7005 > 192.168.1.88:7005: Flags [.], seq 2, ack 9, win 2, length 1 
03-Dec-21 01:37:56 - IP 192.168.1.88:7005 > 192.168.1.200:7005: Flags [P.], seq 9, ack 2, win 2, length 2 
03-Dec-21 01:37:56 - IP 192.168.1.200:7005 > 192.168.1.88:7005: Flags [.], seq 2, ack 11, win 2, length 1 
