02-Dec-21 22:50:03 - IP 192.168.1.88:7005 > 192.168.1.200:7005: Flags [S], seq 0, ack 0, win 1, length 1 
02-Dec-21 22:50:06 - IP 192.168.1.200:7005 > 192.168.1.88:7005: Flags [.], seq 0, ack 1, win 1, length 1 
02-Dec-21 22:50:55 - IP 192.168.1.88:7005 > 192.168.1.200:7005: Flags [P.], seq 1, ack 1, win 1, length 4 
02-Dec-21 22:50:58 - IP 192.168.1.200:7005 > 192.168.1.88:7005: Flags [.], seq 1, ack 5, win 1, length 1 
02-Dec-21 22:50:58 - IP 192.168.1.88:7005 > 192.168.1.200:7005: Flags [P.], seq 5, ack 2, win 2, length 4 
02-Dec-21 22:50:58 - IP 192.168.1.88:7005 > 192.168.1.200:7005: Flags [P.], seq 9, ack 2, win 2, length 4 
02-Dec-21 22:51:01 - IP 192.168.1.200:7005 > 192.168.1.88:7005: Flags [.], seq 2, ack 9, win 2, length 1 
02-Dec-21 22:51:02 - IP 192.168.1.200:7005 > 192.168.1.88:7005: Flags [.], seq 2, ack 13, win 2, length 1 
02-Dec-21 22:51:02 - IP 192.168.1.88:7005 > 192.168.1.200:7005: Flags [P.], seq 13, ack 3, win 4, length 4 
02-Dec-21 22:51:02 - IP 192.168.1.88:7005 > 192.168.1.200:7005: Flags [P.], seq 17, ack 3, win 4, length 4 
02-Dec-21 22:51:02 - IP 192.168.1.88:7005 > 192.168.1.200:7005: Flags [P.], seq 21, ack 3, win 4, length 4 
02-Dec-21 22:51:02 - IP 192.168.1.88:7005 > 192.168.1.200:7005: Flags [P.], seq 25, ack 3, win 4, length 4 
02-Dec-21 22:51:07 - IP 192.168.1.200:7005 > 192.168.1.88:7005: Flags [.], seq 3, ack 17, win 4, length 1 
02-Dec-21 22:51:08 - IP 192.168.1.200:7005 > 192.168.1.88:7005: Flags [.], seq 3, ack 21, win 4, length 1 
02-Dec-21 22:51:09 - IP 192.168.1.200:7005 > 192.168.1.88:7005: Flags [.], seq 3, ack 25, win 4, length 1 
02-Dec-21 22:51:10 - IP 192.168.1.200:7005 > 192.168.1.88:7005: Flags [.], seq 3, ack 29, win 4, length 1 
02-Dec-21 22:51:10 - IP 192.168.1.88:7005 > 192.168.1.200:7005: Flags [P.], seq 29, ack 4, win 8, length 4 
02-Dec-21 22:51:10 - IP 192.168.1.88:7005 > 192.168.1.200:7005: Flags [P.], seq 33, ack 4, win 8, length 4 
02-Dec-21 22:51:10 - IP 192.168.1.88:7005 > 192.168.1.200:7005: Flags [P.], seq 37, ack 4, win 8, length 4 
02-Dec-21 22:51:10 - IP 192.168.1.88:7005 > 192.168.1.200:7005: Flags [P.], seq 41, ack 4, win 8, length 4 
02-Dec-21 22:51:10 - IP 192.168.1.88:7005 > 192.168.1.200:7005: Flags [P.], seq 45, ack 4, win 8, length 4 
02-Dec-21 22:51:10 - IP 192.168.1.88:7005 > 192.168.1.200:7005: Flags [P.], seq 49, ack 4, win 8, length 4 
02-Dec-21 22:51:10 - IP 192.168.1.88:7005 > 192.168.1.200:7005: Flags [P.], seq 53, ack 4, win 8, length 4 
02-Dec-21 22:51:10 - IP 192.168.1.88:7005 > 192.168.1.200:7005: Flags [P.], seq 57, ack 4, win 8, length 4 
02-Dec-21 22:51:19 - IP 192.168.1.200:7005 > 192.168.1.88:7005: Flags [.], seq 4, ack 33, win 8, length 1 
02-Dec-21 22:51:20 - IP 192.168.1.200:7005 > 192.168.1.88:7005: Flags [.], seq 4, ack 37, win 8, length 1 
02-Dec-21 22:51:21 - IP 192.168.1.200:7005 > 192.168.1.88:7005: Flags [.], seq 4, ack 41, win 8, length 1 
02-Dec-21 22:51:22 - IP 192.168.1.200:7005 > 192.168.1.88:7005: Flags [.], seq 4, ack 45, win 8, length 1 
02-Dec-21 22:51:23 - IP 192.168.1.200:7005 > 192.168.1.88:7005: Flags [.], seq 4, ack 49, win 8, length 1 
02-Dec-21 22:51:24 - IP 192.168.1.200:7005 > 192.168.1.88:7005: Flags [.], seq 4, ack 53, win 8, length 1 
02-Dec-21 22:51:25 - IP 192.168.1.200:7005 > 192.168.1.88:7005: Flags [.], seq 4, ack 57, win 8, length 1 
02-Dec-21 22:51:26 - IP 192.168.1.200:7005 > 192.168.1.88:7005: Flags [.], seq 4, ack 61, win 8, length 1 
02-Dec-21 22:51:26 - IP 192.168.1.88:7005 > 192.168.1.200:7005: Flags [P.], seq 61, ack 5, win 8, length 4 
02-Dec-21 22:51:26 - IP 192.168.1.88:7005 > 192.168.1.200:7005: Flags [P.], seq 65, ack 5, win 8, length 4 
02-Dec-21 22:51:26 - IP 192.168.1.88:7005 > 192.168.1.200:7005: Flags [P.], seq 69, ack 5, win 8, length 4 
02-Dec-21 22:51:26 - IP 192.168.1.88:7005 > 192.168.1.200:7005: Flags [P.], seq 73, ack 5, win 8, length 4 
02-Dec-21 22:51:26 - IP 192.168.1.88:7005 > 192.168.1.200:7005: Flags [P.], seq 77, ack 5, win 8, length 4 
02-Dec-21 22:51:26 - IP 192.168.1.88:7005 > 192.168.1.200:7005: Flags [P.], seq 81, ack 5, win 8, length 4 
02-Dec-21 22:51:26 - IP 192.168.1.88:7005 > 192.168.1.200:7005: Flags [P.], seq 85, ack 5, win 8, length 4 
02-Dec-21 22:51:26 - IP 192.168.1.88:7005 > 192.168.1.200:7005: Flags [P.], seq 89, ack 5, win 8, length 4 
02-Dec-21 22:51:35 - IP 192.168.1.200:7005 > 192.168.1.88:7005: Flags [.], seq 5, ack 65, win 8, length 1 
02-Dec-21 22:51:36 - IP 192.168.1.200:7005 > 192.168.1.88:7005: Flags [.], seq 5, ack 69, win 8, length 1 
02-Dec-21 22:51:37 - IP 192.168.1.200:7005 > 192.168.1.88:7005: Flags [.], seq 5, ack 73, win 8, length 1 
02-Dec-21 22:51:38 - IP 192.168.1.200:7005 > 192.168.1.88:7005: Flags [.], seq 5, ack 77, win 8, length 1 
02-Dec-21 22:51:39 - IP 192.168.1.200:7005 > 192.168.1.88:7005: Flags [.], seq 5, ack 81, win 8, length 1 
02-Dec-21 22:51:40 - IP 192.168.1.200:7005 > 192.168.1.88:7005: Flags [.], seq 5, ack 85, win 8, length 1 
02-Dec-21 22:51:41 - IP 192.168.1.200:7005 > 192.168.1.88:7005: Flags [.], seq 5, ack 89, win 8, length 1 
02-Dec-21 22:51:42 - IP 192.168.1.200:7005 > 192.168.1.88:7005: Flags [.], seq 5, ack 93, win 8, length 1 
02-Dec-21 22:51:42 - IP 192.168.1.88:7005 > 192.168.1.200:7005: Flags [P.], seq 93, ack 6, win 8, length 4 
02-Dec-21 22:51:42 - IP 192.168.1.88:7005 > 192.168.1.200:7005: Flags [P.], seq 97, ack 6, win 8, length 4 
02-Dec-21 22:51:42 - IP 192.168.1.88:7005 > 192.168.1.200:7005: Flags [P.], seq 101, ack 6, win 8, length 4 
02-Dec-21 22:51:42 - IP 192.168.1.88:7005 > 192.168.1.200:7005: Flags [P.], seq 105, ack 6, win 8, length 4 
02-Dec-21 22:51:42 - IP 192.168.1.88:7005 > 192.168.1.200:7005: Flags [P.], seq 109, ack 6, win 8, length 4 
02-Dec-21 22:51:42 - IP 192.168.1.88:7005 > 192.168.1.200:7005: Flags [P.], seq 113, ack 6, win 8, length 4 
02-Dec-21 22:51:42 - IP 192.168.1.88:7005 > 192.168.1.200:7005: Flags [P.], seq 117, ack 6, win 8, length 4 
02-Dec-21 22:51:42 - IP 192.168.1.88:7005 > 192.168.1.200:7005: Flags [P.], seq 121, ack 6, win 8, length 4 
02-Dec-21 22:51:51 - IP 192.168.1.200:7005 > 192.168.1.88:7005: Flags [.], seq 6, ack 97, win 8, length 1 
02-Dec-21 22:51:52 - IP 192.168.1.200:7005 > 192.168.1.88:7005: Flags [.], seq 6, ack 101, win 8, length 1 
02-Dec-21 22:51:53 - IP 192.168.1.200:7005 > 192.168.1.88:7005: Flags [.], seq 6, ack 105, win 8, length 1 
02-Dec-21 22:51:54 - IP 192.168.1.200:7005 > 192.168.1.88:7005: Flags [.], seq 6, ack 109, win 8, length 1 
02-Dec-21 22:51:55 - IP 192.168.1.200:7005 > 192.168.1.88:7005: Flags [.], seq 6, ack 113, win 8, length 1 
02-Dec-21 22:51:56 - IP 192.168.1.200:7005 > 192.168.1.88:7005: Flags [.], seq 6, ack 117, win 8, length 1 
02-Dec-21 22:51:57 - IP 192.168.1.200:7005 > 192.168.1.88:7005: Flags [.], seq 6, ack 121, win 8, length 1 
02-Dec-21 22:51:58 - IP 192.168.1.200:7005 > 192.168.1.88:7005: Flags [.], seq 6, ack 125, win 8, length 1 
02-Dec-21 22:51:58 - IP 192.168.1.88:7005 > 192.168.1.200:7005: Flags [P.], seq 125, ack 7, win 8, length 4 
02-Dec-21 22:51:58 - IP 192.168.1.88:7005 > 192.168.1.200:7005: Flags [P.], seq 129, ack 7, win 8, length 4 
02-Dec-21 22:51:58 - IP 192.168.1.88:7005 > 192.168.1.200:7005: Flags [P.], seq 133, ack 7, win 8, length 4 
02-Dec-21 22:51:58 - IP 192.168.1.88:7005 > 192.168.1.200:7005: Flags [P.], seq 137, ack 7, win 8, length 4 
02-Dec-21 22:51:58 - IP 192.168.1.88:7005 > 192.168.1.200:7005: Flags [P.], seq 141, ack 7, win 8, length 4 
02-Dec-21 22:51:58 - IP 192.168.1.88:7005 > 192.168.1.200:7005: Flags [P.], seq 145, ack 7, win 8, length 4 
02-Dec-21 22:51:58 - IP 192.168.1.88:7005 > 192.168.1.200:7005: Flags [P.], seq 149, ack 7, win 8, length 4 
02-Dec-21 22:51:58 - IP 192.168.1.88:7005 > 192.168.1.200:7005: Flags [P.], seq 153, ack 7, win 8, length 4 
02-Dec-21 22:52:07 - IP 192.168.1.200:7005 > 192.168.1.88:7005: Flags [.], seq 7, ack 129, win 8, length 1 
02-Dec-21 22:52:08 - IP 192.168.1.200:7005 > 192.168.1.88:7005: Flags [.], seq 7, ack 133, win 8, length 1 
02-Dec-21 22:52:09 - IP 192.168.1.200:7005 > 192.168.1.88:7005: Flags [.], seq 7, ack 137, win 8, length 1 
02-Dec-21 22:52:10 - IP 192.168.1.200:7005 > 192.168.1.88:7005: Flags [.], seq 7, ack 141, win 8, length 1 
02-Dec-21 22:52:11 - IP 192.168.1.200:7005 > 192.168.1.88:7005: Flags [.], seq 7, ack 145, win 8, length 1 
02-Dec-21 22:52:12 - IP 192.168.1.200:7005 > 192.168.1.88:7005: Flags [.], seq 7, ack 149, win 8, length 1 
02-Dec-21 22:52:13 - IP 192.168.1.200:7005 > 192.168.1.88:7005: Flags [.], seq 7, ack 153, win 8, length 1 
02-Dec-21 22:52:14 - IP 192.168.1.200:7005 > 192.168.1.88:7005: Flags [.], seq 7, ack 157, win 8, length 1 
02-Dec-21 22:52:14 - IP 192.168.1.88:7005 > 192.168.1.200:7005: Flags [P.], seq 157, ack 8, win 8, length 4 
02-Dec-21 22:52:14 - IP 192.168.1.88:7005 > 192.168.1.200:7005: Flags [P.], seq 161, ack 8, win 8, length 4 
02-Dec-21 22:52:14 - IP 192.168.1.88:7005 > 192.168.1.200:7005: Flags [P.], seq 165, ack 8, win 8, length 4 
02-Dec-21 22:52:14 - IP 192.168.1.88:7005 > 192.168.1.200:7005: Flags [P.], seq 169, ack 8, win 8, length 4 
02-Dec-21 22:52:14 - IP 192.168.1.88:7005 > 192.168.1.200:7005: Flags [P.], seq 173, ack 8, win 8, length 4 
02-Dec-21 22:52:14 - IP 192.168.1.88:7005 > 192.168.1.200:7005: Flags [P.], seq 177, ack 8, win 8, length 4 
02-Dec-21 22:52:14 - IP 192.168.1.88:7005 > 192.168.1.200:7005: Flags [P.], seq 181, ack 8, win 8, length 4 
02-Dec-21 22:52:14 - IP 192.168.1.88:7005 > 192.168.1.200:7005: Flags [P.], seq 185, ack 8, win 8, length 4 
02-Dec-21 22:52:23 - IP 192.168.1.200:7005 > 192.168.1.88:7005: Flags [.], seq 8, ack 161, win 8, length 1 
02-Dec-21 22:52:24 - IP 192.168.1.200:7005 > 192.168.1.88:7005: Flags [.], seq 8, ack 165, win 8, length 1 
02-Dec-21 22:52:25 - IP 192.168.1.200:7005 > 192.168.1.88:7005: Flags [.], seq 8, ack 169, win 8, length 1 
02-Dec-21 22:52:26 - IP 192.168.1.200:7005 > 192.168.1.88:7005: Flags [.], seq 8, ack 173, win 8, length 1 
02-Dec-21 22:52:27 - IP 192.168.1.200:7005 > 192.168.1.88:7005: Flags [.], seq 8, ack 177, win 8, length 1 
02-Dec-21 22:52:28 - IP 192.168.1.200:7005 > 192.168.1.88:7005: Flags [.], seq 8, ack 181, win 8, length 1 
02-Dec-21 22:52:29 - IP 192.168.1.200:7005 > 192.168.1.88:7005: Flags [.], seq 8, ack 185, win 8, length 1 
02-Dec-21 22:52:30 - IP 192.168.1.200:7005 > 192.168.1.88:7005: Flags [.], seq 8, ack 189, win 8, length 1 
02-Dec-21 22:52:30 - IP 192.168.1.88:7005 > 192.168.1.200:7005: Flags [P.], seq 189, ack 9, win 8, length 4 
02-Dec-21 22:52:30 - IP 192.168.1.88:7005 > 192.168.1.200:7005: Flags [P.], seq 193, ack 9, win 8, length 4 
02-Dec-21 22:52:30 - IP 192.168.1.88:7005 > 192.168.1.200:7005: Flags [P.], seq 197, ack 9, win 8, length 4 
02-Dec-21 22:52:30 - IP 192.168.1.88:7005 > 192.168.1.200:7005: Flags [P.], seq 201, ack 9, win 8, length 4 
02-Dec-21 22:52:30 - IP 192.168.1.88:7005 > 192.168.1.200:7005: Flags [P.], seq 205, ack 9, win 8, length 1 
02-Dec-21 22:52:30 - IP 192.168.1.88:7005 > 192.168.1.200:7005: Flags [P.], seq 206, ack 9, win 8, length 1 
02-Dec-21 22:52:30 - IP 192.168.1.88:7005 > 192.168.1.200:7005: Flags [P.], seq 207, ack 9, win 8, length 1 
02-Dec-21 22:52:30 - IP 192.168.1.88:7005 > 192.168.1.200:7005: Flags [P.], seq 208, ack 9, win 8, length 1 
02-Dec-21 22:52:39 - IP 192.168.1.200:7005 > 192.168.1.88:7005: Flags [.], seq 9, ack 193, win 8, length 1 
02-Dec-21 22:52:40 - IP 192.168.1.200:7005 > 192.168.1.88:7005: Flags [.], seq 9, ack 197, win 8, length 1 
02-Dec-21 22:52:41 - IP 192.168.1.200:7005 > 192.168.1.88:7005: Flags [.], seq 9, ack 201, win 8, length 1 
02-Dec-21 22:52:42 - IP 192.168.1.200:7005 > 192.168.1.88:7005: Flags [.], seq 9, ack 205, win 8, length 1 
02-Dec-21 22:52:43 - IP 192.168.1.200:7005 > 192.168.1.88:7005: Flags [.], seq 9, ack 206, win 8, length 1 
02-Dec-21 22:52:44 - IP 192.168.1.200:7005 > 192.168.1.88:7005: Flags [.], seq 9, ack 207, win 8, length 1 
02-Dec-21 22:52:45 - IP 192.168.1.200:7005 > 192.168.1.88:7005: Flags [.], seq 9, ack 208, win 8, length 1 
02-Dec-21 22:52:46 - IP 192.168.1.200:7005 > 192.168.1.88:7005: Flags [.], seq 9, ack 209, win 8, length 1 
